{
  "$schema": "https://venapce.inflowenger.com/schemas/catalog-1.json",
  "schema": 1,
  "name": "Venapce example operations",
  "description": "Worked operation packages that ship with the panel. Import one from Operations → Import → local folder, or point the URL importer at this repository.",
  "operations": [
    {
      "id": "linux-fleet-http-audit",
      "path": "linux-fleet-http-audit",
      "name": "Linux fleet HTTP audit",
      "version": "1.0.0",
      "description": "Who is serving HTTP on the fleet, where, and under which hostnames — one Stage row per web server.",
      "tags": ["linux", "http", "nginx", "exposure", "inventory"],
      "scale": ["vps", "fleet", "smb"]
    }
  ]
}
